[
  {
    "surface_type": "crates_io_package_index_metadata",
    "asset_ref": "clap@4.5.4",
    "first_seen_at": "2026-07-04T07:27:17Z",
    "last_observed_at": "2026-10-19T17:33:53Z",
    "event_count_total": 94,
    "persistence_duration_days": 107,
    "last_state_update": "2026-10-19T17:34:03Z",
    "state_level": "persistent"
  },
  {
    "surface_type": "crates_io_package_index_metadata",
    "asset_ref": "serde@1.0.197",
    "first_seen_at": "2026-07-04T07:27:15Z",
    "last_observed_at": "2026-10-19T17:33:51Z",
    "event_count_total": 94,
    "persistence_duration_days": 107,
    "last_state_update": "2026-10-19T17:34:03Z",
    "state_level": "persistent"
  },
  {
    "surface_type": "crates_io_package_index_metadata",
    "asset_ref": "tokio@1.36.0",
    "first_seen_at": "2026-07-04T07:27:16Z",
    "last_observed_at": "2026-10-19T17:33:52Z",
    "event_count_total": 94,
    "persistence_duration_days": 107,
    "last_state_update": "2026-10-19T17:34:03Z",
    "state_level": "persistent"
  },
  {
    "surface_type": "ietf_internet_draft",
    "asset_ref": "draft-ietf-httpbis-incremental-00",
    "first_seen_at": "2026-04-04T10:42:21Z",
    "last_observed_at": "2026-10-19T17:33:13Z",
    "event_count_total": 174,
    "persistence_duration_days": 198,
    "last_state_update": "2026-10-19T17:34:03Z",
    "state_level": "persistent"
  },
  {
    "surface_type": "maven_central_artifact_metadata",
    "asset_ref": "com.google.guava:guava:33.1.0-jre:jar",
    "first_seen_at": "2026-05-26T11:49:58Z",
    "last_observed_at": "2026-10-19T17:33:38Z",
    "event_count_total": 130,
    "persistence_duration_days": 146,
    "last_state_update": "2026-10-19T17:34:03Z",
    "state_level": "persistent"
  },
  {
    "surface_type": "maven_central_artifact_metadata",
    "asset_ref": "org.apache.commons:commons-lang3:3.14.0:jar",
    "first_seen_at": "2026-05-21T07:12:56Z",
    "last_observed_at": "2026-10-19T17:33:25Z",
    "event_count_total": 135,
    "persistence_duration_days": 151,
    "last_state_update": "2026-10-19T17:34:03Z",
    "state_level": "persistent"
  },
  {
    "surface_type": "maven_central_artifact_metadata",
    "asset_ref": "org.apache.maven:maven-parent:42:pom",
    "first_seen_at": "2026-05-26T11:50:11Z",
    "last_observed_at": "2026-10-19T17:33:51Z",
    "event_count_total": 129,
    "persistence_duration_days": 146,
    "last_state_update": "2026-10-19T17:34:03Z",
    "state_level": "persistent"
  },
  {
    "surface_type": "npm_package_metadata",
    "asset_ref": "react@18.2.0",
    "first_seen_at": "2026-04-04T10:42:21Z",
    "last_observed_at": "2026-10-19T17:33:11Z",
    "event_count_total": 173,
    "persistence_duration_days": 198,
    "last_state_update": "2026-10-19T17:34:03Z",
    "state_level": "persistent"
  },
  {
    "surface_type": "oci_manifest",
    "asset_ref": "registry-1.docker.io/library/nginx:1.27.4",
    "first_seen_at": "2026-04-04T10:42:21Z",
    "last_observed_at": "2026-10-19T17:33:12Z",
    "event_count_total": 174,
    "persistence_duration_days": 198,
    "last_state_update": "2026-10-19T17:34:03Z",
    "state_level": "persistent"
  },
  {
    "surface_type": "pypi_release_metadata",
    "asset_ref": "requests==2.32.0",
    "first_seen_at": "2026-03-12T14:05:00Z",
    "last_observed_at": "2026-10-19T17:33:11Z",
    "event_count_total": 174,
    "persistence_duration_days": 221,
    "last_state_update": "2026-10-19T17:34:03Z",
    "state_level": "persistent"
  }
]
